<?xml version="1.0" encoding="utf-8"?>
<current xmlns="current-weather"
         xmlns:xsi="http://www.w3.org/2001/XMLSchema-instance"
         xsi:schemaLocation="current-weather current-weather.xsd">
    <city id="2643743" name="London">
        <coord lon="-0.13" lat="51.51"/>
        <country>GB</country>
        <sun rise="2014-08-10T04:38:59" set="2014-08-10T19:32:38"/>
    </city>
    <temperature value="20.21" min="18" max="22.22" unit="celsius"/>
    <humidity value="83" unit="%"/>
    <pressure value="992" unit="hPa"/>
    <wind>
        <speed value="7.7" name="Moderate breeze"/>
        <direction value="200" code="SSW" name="South-southwest"/>
    </wind>
    <clouds value="75" name="broken clouds"/>
    <visibility/>
    <precipitation value="0.75" mode="rain" unit="3h"/>
    <weather number="521" value="дождь" icon="09d"/>
    <lastupdate value="2014-08-10T12:09:17"/>
</current>