<?xml version="1.0" encoding="utf-8"?>
<current xmlns="current-weather"
         xmlns:xsi="http://www.w3.org/2001/XMLSchema-instance"
         xsi:schemaLocation="current-weather current-weather.xsd">
    <city id="524901" name="Moscow">
        <coord lon="37.62" lat="55.75"/>
        <country>RU</country>
        <sun rise="2014-08-10T01:52:38" set="2014-08-10T17:17:01"/>
    </city>
    <temperature value="28.33" min="25.56" max="30.6" unit="celsius"/>
    <humidity value="47" unit="%"/>
    <pressure value="1011" unit="hPa"/>
    <wind>
        <speed value="4" name="Gentle Breeze"/>
        <direction value="310" code="NW" name="Northwest"/>
    </wind>
    <clouds value="0" name="clear sky"/>
    <visibility/>
    <precipitation mode="no"/>
    <weather number="800" value="ясно" icon="01d"/>
    <lastupdate value="2014-08-10T11:53:39"/>
</current>