<?xml version="1.0" encoding="utf-8"?>
<current xmlns="current-weather"
         xmlns:xsi="http://www.w3.org/2001/XMLSchema-instance"
         xsi:schemaLocation="current-weather current-weather.xsd">
    <city id="1486209" name="Yekaterinburg">
        <coord lon="60.61" lat="56.86"/>
        <country>RU</country>
        <sun rise="2014-08-10T00:15:55" set="2014-08-10T15:49:50"/>
    </city>
    <temperature value="30" min="30" max="30" unit="celsius"/>
    <humidity value="42" unit="%"/>
    <pressure value="1007" unit="hPa"/>
    <wind>
        <speed value="5" name="Gentle Breeze"/>
        <direction value="170" code="S" name="South"/>
    </wind>
    <clouds value="0" name="clear sky"/>
    <visibility/>
    <precipitation mode="no"/>
    <weather number="800" value="ясно" icon="01d"/>
    <lastupdate value="2014-08-10T11:09:09"/>
</current>